<?xml version="1.0" encoding="UTF-8"?>
<!-- edited with XML Spy v3.5 beta 3 build Dec 21 2000 (http://www.xmlspy.com) by Curt Arnold (Self) -->
<Registry xmlns="http://www.argouml.org/Namespace/0.9/Registry" xmlns:xsi="http://www.w3.org/2000/10/XMLSchema-instance" xsi:schemaLocation="http://www.argouml.org/Namespace/0.9/Registry
xml\dtd\registry.xsd">
	<UMLProfile id="profile1" name="default.xmi">
		<TagName name="fred" baseClass="ModelElement"/>
		<FigShape name="BoundaryShape" renderer="org.example.ArgoUML.shapes.BoundaryShape" stereotype="Boundary" baseClass="Class"/>
	</UMLProfile>
	<CritiqueGroup name="UML Critiques" id="UMLCritiques" defaultPackage="org.argouml.uml.cognitive.critics">
		<Critique class="CrAlreadyRealizes"/>
		<Critique class="CrAssocNameConflict"/>
		<Critique class="CrAttrNameConflict"/>
		<Critique class="CrCallWithoutReturn"/>
		<Critique class="CrCircularAssocClass"/>
		<Critique class="CrCircularComposition"/>
		<Critique class="CrCircularInheritance"/>
		<Critique class="CrClassMustBeAbstract"/>
		<Critique class="CrClassWithoutComponent"/>
		<Critique class="CrCompInstanceWithoutNode"/>
		<Critique class="CrComponentInstanceWithoutClassifier"/>
		<Critique class="CrComponentWithoutNode"/>
		<Critique class="CrConflictingComposites"/>
		<Critique class="CrConstructorNeeded"/>
		<Critique class="CrCrossNamespaceAssoc"/>
		<Critique class="CrDisambigClassName"/>
		<Critique class="CrDisambigStateName"/>
		<Critique class="CrDupParamName"/>
		<Critique class="CrDupRoleNames"/>
		<Critique class="CrEmptyPackage"/>
		<Critique class="CrFinalSubclassed"/>
		<Critique class="CrIllegalGeneralization"/>
		<Critique class="CrIllegalName"/>
		<Critique class="CrInstanceWithoutClassifier"/>
		<Critique class="CrInterfaceAllPublic"/>
		<Critique class="CrInterfaceOperOnly"/>
		<Critique class="CrInterfaceWithoutComponent"/>
		<Critique class="CrInvalidBranch"/>
		<Critique class="CrInvalidFork"/>
		<Critique class="CrInvalidInitial"/>
		<Critique class="CrInvalidJoin"/>
		<Critique class="CrLinkWithoutStimulus"/>
		<Critique class="CrMergeClasses"/>
		<Critique class="CrMissingAttrName"/>
		<Critique class="CrMissingClassName"/>
		<Critique class="CrMissingOperName"/>
		<Critique class="CrMissingStateName"/>
		<Critique class="CrMultiComposite"/>
		<Critique class="CrMultipleAgg"/>
		<Critique class="CrMultipleInitialStates"/>
		<Critique class="CrNameConflict"/>
		<Critique class="CrNameConflictAC"/>
		<Critique class="CrNameConfusion"/>
		<Critique class="CrNavFromInterface"/>
		<Critique class="CrNoAssociations"/>
		<Critique class="CrNodeInsideElement"/>
		<Critique class="CrNodeInstanceInsideElement"/>
		<Critique class="CrNodeInstanceWithoutClassifier"/>
		<Critique class="CrNoGuard"/>
		<Critique class="CrNoIncomingTransitions"/>
		<Critique class="CrNoInitialState"/>
		<Critique class="CrNoInstanceVariables"/>
		<Critique class="CrNonAggDataType"/>
		<Critique class="CrNoOperations"/>
		<Critique class="CrNoOutgoingTransitions"/>
		<Critique class="CrNoTransitions"/>
		<Critique class="CrNoTriggerOrGuard"/>
		<Critique class="CrNWayAgg"/>
		<Critique class="CrObjectWithoutClassifier"/>
		<Critique class="CrObjectWithoutComponent"/>
		<Critique class="CrOperNameConflict"/>
		<Critique class="CrOppEndConflict"/>
		<Critique class="CrOppEndVsAttr"/>
		<Critique class="CrReservedName"/>
		<Critique class="CrReturnWithoutCall"/>
		<Critique class="CrSeqInstanceWithoutClassifier"/>
		<Critique class="CrSignatureConflict"/>
		<Critique class="CrStimulusWithWrongPosition"/>
		<Critique class="CrSubclassReference"/>
		<Critique class="CrTooManyAssoc"/>
		<Critique class="CrTooManyAttr"/>
		<Critique class="CrTooManyClasses"/>
		<Critique class="CrTooManyOper"/>
		<Critique class="CrTooManyStates"/>
		<Critique class="CrTooManyTransitions"/>
		<Critique class="CrUnconventionalAttrName"/>
		<Critique class="CrUnconventionalClassName"/>
		<Critique class="CrUnconventionalOperName"/>
		<Critique class="CrUnconventionalPackName"/>
		<Critique class="CrUnnavigableAssoc"/>
		<Critique class="CrUselessAbstract"/>
		<Critique class="CrUselessInterface"/>
		<Critique class="CrUtilityViolated"/>
		<Critique class="CrWrongDepEnds"/>
		<Critique class="CrWrongLinkEnds"/>
		<Critique class="CrAlreadyRealizes"/>
		<Critique class="CrAssocNameConflict"/>
	</CritiqueGroup>
	<CritiqueGroup name="Java Critiques" id="JavaCritiques" defaultPackage="org.argouml.language.java.cognitive.critics">
		<Critique class="CrMultipleInheritance"/>
	</CritiqueGroup>
	<CodeGenerator name="JavaGen" id="JavaGen" class="org,example.CodeGenerators.JavaGen"/>
	<CodeAnalyzer name="JavaRE" id="JavaRE" class="org.example.CodeGenerators.JavaRE" description="Sample Java Code Reverse engineering"/>
	<Notation name="UML Notation" id="umlNotation" class="org.argouml.Notations.UMLNotation" description="Textual notation per UML spec"/>
	<Frame id="bigFrame" height="900" width="700" title="ArgoUML" notation="umlNotation" class="org.argouml.application.MainFrame" theme="org.argouml.themes.JasonTheme" defaultPackage="org.argouml.application">
		<Pane/>
		<Pane/>
		<Pane defaultPackage="org.argouml.uml.ui">
			<TabbedPane>
				<Tab class="org.argouml.cognitive.ui.TabToDo"/>
				<Tab class="TabProps"/>
				<Tab class="TabDocumentation"/>
				<Tab class="TabStyle"/>
				<Tab class="TabDocs"/>
				<Tab class="TabSrc"/>
				<Tab class="TabConstraints"/>
				<Tab class="TabTaggedValues"/>
				<Tab class="org.argouml.cognitive.checklist.ui.TabCheckList"/>
				<Tab class="History"/>
				<Tab class="TabHash"/>
			</TabbedPane>
		</Pane>
	</Frame>
	<Personality name="JavaPersonality" frame="bigFrame" profiles="profile1" isDefault="false" description="Default Java profile" behaviors="JavaGen JavaRE UMLCritiques JavaCritiques"/>
</Registry>
